{
  "$schema": "https://json-schema.org/draft/2020-12/schema",
  "title": "HostDesiredStateV2",
  "type": "object",
  "properties": {
    "builds": {
      "type": "array",
      "items": {
        "$ref": "#/$defs/DesiredBuildV1"
      }
    },
    "cached_guest_tools": {
      "type": "array",
      "items": {
        "$ref": "#/$defs/DesiredGuestToolsV1"
      }
    },
    "cached_images": {
      "type": "array",
      "items": {
        "$ref": "#/$defs/DesiredCachedImageV1"
      }
    },
    "generated_at_unix_ms": {
      "type": "integer",
      "format": "int64"
    },
    "host_id": {
      "type": "string"
    },
    "owner_user_id": {
      "type": "string"
    },
    "schema_version": {
      "type": "integer",
      "format": "uint16",
      "maximum": 6,
      "minimum": 6
    },
    "scope": {
      "$ref": "#/$defs/HostScope"
    },
    "source_compiles": {
      "type": "array",
      "items": {
        "$ref": "#/$defs/DesiredSourceCompileV1"
      }
    },
    "version": {
      "type": "integer",
      "format": "uint64",
      "minimum": 0
    },
    "vms": {
      "type": "array",
      "items": {
        "$ref": "#/$defs/DesiredVmV2"
      }
    }
  },
  "required": [
    "scope",
    "owner_user_id",
    "schema_version",
    "host_id",
    "version",
    "generated_at_unix_ms",
    "cached_images",
    "vms",
    "builds"
  ],
  "$defs": {
    "DesiredBuildV1": {
      "type": "object",
      "properties": {
        "arch": {
          "$ref": "#/$defs/ImageArchitecture"
        },
        "build_id": {
          "type": "string"
        },
        "bundle_ref": {
          "type": "string"
        },
        "content_hash": {
          "type": "string"
        },
        "rev": {
          "type": "string"
        },
        "scenario_id": {
          "type": "string"
        }
      },
      "required": [
        "build_id",
        "scenario_id",
        "arch",
        "rev",
        "content_hash",
        "bundle_ref"
      ]
    },
    "DesiredCachedImageV1": {
      "type": "object",
      "properties": {
        "image_id": {
          "type": "string"
        },
        "image_key": {
          "$ref": "#/$defs/ImageKey"
        }
      },
      "required": [
        "image_key",
        "image_id"
      ]
    },
    "DesiredGuestToolsV1": {
      "type": "object",
      "properties": {
        "bootstrap_abi": {
          "type": "integer",
          "format": "uint16",
          "maximum": 65535,
          "minimum": 0
        },
        "kino_sha256": {
          "type": "string"
        },
        "tools_disk_sha256": {
          "type": "string"
        },
        "tools_disk_size_bytes": {
          "type": "integer",
          "format": "uint64",
          "minimum": 0
        }
      },
      "additionalProperties": false,
      "required": [
        "tools_disk_sha256",
        "tools_disk_size_bytes",
        "kino_sha256",
        "bootstrap_abi"
      ]
    },
    "DesiredSourceCompileV1": {
      "description": "One repository snapshot a builder compiles. It carries no secret and no\nscope: the Worker takes both from the compile row.",
      "type": "object",
      "properties": {
        "arch": {
          "$ref": "#/$defs/ImageArchitecture"
        },
        "attempt": {
          "type": "integer",
          "format": "uint32",
          "minimum": 0
        },
        "compile_id": {
          "type": "string"
        },
        "rev": {
          "type": "string"
        },
        "snapshot_ref": {
          "type": "string"
        },
        "validate_only": {
          "type": "boolean"
        }
      },
      "required": [
        "compile_id",
        "attempt",
        "snapshot_ref",
        "rev",
        "validate_only",
        "arch"
      ]
    },
    "DesiredVmPhase": {
      "type": "string",
      "enum": [
        "running",
        "absent"
      ]
    },
    "DesiredVmV2": {
      "type": "object",
      "properties": {
        "desired_phase": {
          "$ref": "#/$defs/DesiredVmPhase"
        },
        "generation": {
          "type": "integer",
          "format": "uint64",
          "minimum": 1
        },
        "guest_tools": {
          "$ref": "#/$defs/DesiredGuestToolsV1"
        },
        "image_id": {
          "type": "string"
        },
        "image_key": {
          "$ref": "#/$defs/ImageKey"
        },
        "lease_expires_at_unix_ms": {
          "type": "integer",
          "format": "int64"
        },
        "owner_user_id": {
          "type": "string"
        },
        "resources": {
          "$ref": "#/$defs/VmResourcesV3"
        },
        "run_id": {
          "type": "string"
        },
        "runtime_execution_id": {
          "type": "string"
        },
        "ssh_authorized_keys_openssh": {
          "type": "array",
          "items": {
            "type": "string"
          }
        },
        "vm_id": {
          "type": "string"
        },
        "vm_name": {
          "type": "string"
        }
      },
      "required": [
        "vm_id",
        "owner_user_id",
        "runtime_execution_id",
        "generation",
        "run_id",
        "vm_name",
        "desired_phase",
        "image_key",
        "image_id",
        "guest_tools",
        "resources",
        "ssh_authorized_keys_openssh",
        "lease_expires_at_unix_ms"
      ]
    },
    "HostScope": {
      "type": "string",
      "enum": [
        "personal",
        "platform",
        "organization"
      ]
    },
    "ImageArchitecture": {
      "type": "string",
      "enum": [
        "x86_64",
        "aarch64"
      ]
    },
    "ImageKey": {
      "type": "object",
      "properties": {
        "arch": {
          "$ref": "#/$defs/ImageArchitecture"
        },
        "scenario": {
          "type": "string"
        },
        "vm": {
          "type": "string"
        }
      },
      "required": [
        "scenario",
        "vm",
        "arch"
      ]
    },
    "VmResourcesV3": {
      "type": "object",
      "properties": {
        "cpu_millis": {
          "type": "integer",
          "format": "uint32",
          "minimum": 1
        },
        "disk_mib": {
          "type": "integer",
          "format": "uint32",
          "minimum": 0
        },
        "memory_mib": {
          "type": "integer",
          "format": "uint32",
          "minimum": 0
        }
      },
      "required": [
        "cpu_millis",
        "memory_mib",
        "disk_mib"
      ]
    }
  }
}
