{
  "schema_version": 6,
  "host_id": "host-alpha",
  "version": 42,
  "generated_at_unix_ms": 1762041600000,
  "cached_images": [
    {
      "image_key": {
        "scenario": "broken-nginx",
        "vm": "webserver",
        "arch": "x86_64"
      },
      "image_id": "565d9a5e65009697de935eab180e6e7ef929a01b7e5963199fb168357021cb19"
    }
  ],
  "vms": [
    {
      "run_id": "run-20260702-a",
      "vm_name": "webserver",
      "desired_phase": "running",
      "image_key": {
        "scenario": "broken-nginx",
        "vm": "webserver",
        "arch": "x86_64"
      },
      "image_id": "565d9a5e65009697de935eab180e6e7ef929a01b7e5963199fb168357021cb19",
      "guest_tools": {
        "tools_disk_sha256": "1111111111111111111111111111111111111111111111111111111111111111",
        "tools_disk_size_bytes": 67108864,
        "kino_sha256": "2222222222222222222222222222222222222222222222222222222222222222",
        "bootstrap_abi": 2
      },
      "resources": {
        "cpu_millis": 125,
        "memory_mib": 512,
        "disk_mib": 4096
      },
      "ssh_authorized_keys_openssh": [
        "ssh-ed25519 AAAAC3NzaC1lZDI1NTE5AAAAIrunkey user@example"
      ],
      "lease_expires_at_unix_ms": 1762045200000,
      "owner_user_id": "user-1",
      "runtime_execution_id": "execution-1",
      "generation": 1,
      "vm_id": "vm-webserver"
    }
  ],
  "builds": [
    {
      "build_id": "build-broken-nginx-amd64-001",
      "scenario_id": "broken-nginx",
      "arch": "x86_64",
      "rev": "0123456789abcdef0123456789abcdef01234567",
      "content_hash": "dddddddddddddddddddddddddddddddddddddddddddddddddddddddddddddddd",
      "bundle_ref": "builds/bundles/0123456789abcdef0123456789abcdef01234567.tar.gz"
    }
  ],
  "scope": "personal",
  "owner_user_id": "user-1"
}
